{
  "name": "Texture Channel (flipped)",
  "width": 64,
  "height": 64,
  "passes": [
    {
      "name": "Image",
      "shader": "image.glsl",
      "channels": {
        "0": {
          "type": "texture",
          "source": "pattern.png",
          "filter": "nearest",
          "wrap": "clamp",
          "flipY": true
        }
      }
    }
  ]
}
