{
  "$schema": "../config.schema.json",
  "name": "Pacman Game",
  "width": 1280,
  "height": 720,
  "common": "common.glsl",
  "passes": [
    {
      "name": "BufferA",
      "shader": "buffera.glsl",
      "channels": {
        "0": { "type": "buffer", "source": "BufferA" },
        "1": { "type": "keyboard" }
      }
    },
    {
      "name": "BufferB",
      "shader": "bufferb.glsl",
      "channels": {
        "0": { "type": "buffer", "source": "BufferA" }
      }
    },
    {
      "name": "Image",
      "shader": "image.glsl",
      "channels": {
        "0": { "type": "buffer", "source": "BufferA", "filter": "nearest" },
        "1": { "type": "buffer", "source": "BufferB" }
      }
    }
  ]
}
