{
  "$schema": "../../shaders/config.schema.json",
  "name": "Alpha Channel Self Test",
  "width": 64,
  "height": 64,
  "passes": [
    {
      "name": "BufferA",
      "shader": "buffera.glsl",
      "channels": {
        "0": { "type": "buffer", "source": "BufferA" }
      }
    },
    {
      "name": "Image",
      "shader": "image.glsl",
      "channels": {
        "0": { "type": "buffer", "source": "BufferA" }
      }
    }
  ]
}
