{
  "$schema": "../config.schema.json",
  "name": "Simple Write Test",
  "width": 800,
  "height": 600,
  "passes": [
    {
      "name": "BufferA",
      "shader": "buffera.glsl",
      "width": 256,
      "height": 256
    },
    {
      "name": "Image",
      "shader": "image.glsl",
      "channels": {
        "0": { "type": "buffer", "source": "BufferA" }
      }
    }
  ]
}
