{
  "$schema": "../config.schema.json",
  "name": "Wormhole",
  "width": 1300,
  "height": 1000,
  "common": "common.glsl",
  "passes": [
    {
      "name": "BufferA",
      "shader": "buffera.glsl",
      "channels": {
        "0": { "type": "buffer", "source": "BufferA" },
        "1": { "type": "keyboard" }
      }
    },
    {
      "name": "Image",
      "shader": "image.glsl",
      "channels": {
        "0": { "type": "buffer", "source": "BufferA" }
      }
    }
  ]
}
